{
  "schema": "cassandra-index-digest",
  "schema_version": 1,
  "week": "2026-09-27",
  "subject": "Cassandra Index, неделя 27 сентября 2026 года: 47 из 100, опасно, -9",
  "text": "Cassandra Index — неделя 27 сентября 2026 года\n1. Мировой индекс — 47 из 100; изменение за неделю -9; состояние «опасно».\n2. Драйвер 1: Удары далеко за линией фронта участились. Вклад — высокий.\n3. Драйвер 2: Санкционное противостояние ужесточилось. Вклад — высокий.\n4. Драйвер 3: Напряжённость на восточном фланге НАТО выросла. Вклад — средний.\n5. Сильнее всего изменились регионы: Ближний Восток (-12), Южная Азия (-10), Африка (-10).\nРегионы: Ближний Восток — 48 (-12); Южная Азия — 49 (-10); Африка — 47 (-10).\nПокрытие критериев недели — 27 из 46.\nСайт: https://cassindex.ru\nДанные: https://cassindex.ru/data/public/index.json\nКривая: https://cassindex.ru/data/public/trend.svg\nАрхив выпусков: https://cassindex.ru/digest.html\n",
  "html": "<!doctype html>\n<html lang=\"ru\">\n<head>\n  <meta charset=\"utf-8\">\n  <title>Cassandra Index, неделя 27 сентября 2026 года: 47 из 100, опасно, -9</title>\n</head>\n<body>\n  <h1>Cassandra Index — неделя 27 сентября 2026 года</h1>\n  <ol>\n    <li>Мировой индекс — 47 из 100; изменение за неделю -9; состояние «опасно».</li>\n    <li>Драйвер 1: Удары далеко за линией фронта участились. Вклад — высокий.</li>\n    <li>Драйвер 2: Санкционное противостояние ужесточилось. Вклад — высокий.</li>\n    <li>Драйвер 3: Напряжённость на восточном фланге НАТО выросла. Вклад — средний.</li>\n    <li>Сильнее всего изменились регионы: Ближний Восток (-12), Южная Азия (-10), Африка (-10).</li>\n  </ol>\n  <p>Регионы: Ближний Восток — 48 (-12); Южная Азия — 49 (-10); Африка — 47 (-10).</p>\n  <p>Покрытие критериев недели — 27 из 46.</p>\n  <p>\n    <a href=\"https://cassindex.ru\">Сайт</a> · \n    <a href=\"https://cassindex.ru/data/public/index.json\">Данные (JSON)</a> · \n    <a href=\"https://cassindex.ru/data/public/trend.svg\">Кривая</a> · \n    <a href=\"https://cassindex.ru/digest.html\">Архив выпусков</a>\n  </p>\n</body>\n</html>\n",
  "telegram": "<b>Cassandra Index — неделя 27 сентября 2026 года</b>\n1. Мировой индекс — 47 из 100; изменение за неделю -9; состояние «опасно».\n2. Драйвер 1: Удары далеко за линией фронта участились. Вклад — высокий.\n3. Драйвер 2: Санкционное противостояние ужесточилось. Вклад — высокий.\n4. Драйвер 3: Напряжённость на восточном фланге НАТО выросла. Вклад — средний.\n5. Сильнее всего изменились регионы: Ближний Восток (-12), Южная Азия (-10), Африка (-10).\nРегионы: Ближний Восток — 48 (-12); Южная Азия — 49 (-10); Африка — 47 (-10).\nПокрытие критериев недели — 27 из 46.\n<a href=\"https://cassindex.ru\">Сайт</a> · <a href=\"https://cassindex.ru/data/public/index.json\">Данные JSON</a> · <a href=\"https://cassindex.ru/data/public/trend.svg\">Кривая</a> · <a href=\"https://cassindex.ru/digest.html\">Архив</a>",
  "meta": {
    "items": 5,
    "regions": 3,
    "hasPrev": true
  }
}
