{
  "schema": "cassandra-index-digest",
  "schema_version": 1,
  "week": "2026-10-25",
  "subject": "Cassandra Index, неделя 25 октября 2026 года: 68 из 100, очень опасно, +4",
  "text": "Cassandra Index — неделя 25 октября 2026 года\n1. Мировой индекс — 68 из 100; изменение за неделю +4; состояние «очень опасно».\n2. Драйвер 1: Вашингтон и Тегеран на пороге удара, Ормуз перекрыт. Вклад — высокий.\n3. Драйвер 2: Йеменская война бьёт по аэропортам и нефти Саудовской Аравии. Вклад — высокий.\n4. Драйвер 3: Олешки: гуманитарное перемирие согласовано, но фронт не стих. Вклад — высокий.\n5. Слой предвестников (Д9) — 39 из 100; сигналящих подгрупп 7 из 8.\nРегионы: Ближний Восток — 78 (+9); Северная Америка — 72 (+6); Украина и Молдова — 68 (+5).\nПокрытие критериев недели — 39 из 46.\nСайт: https://cassindex.ru\nДанные: https://cassindex.ru/data/public/index.json\nКривая: https://cassindex.ru/data/public/trend.svg\nАрхив выпусков: https://cassindex.ru/digest.html\n",
  "html": "<!doctype html>\n<html lang=\"ru\">\n<head>\n  <meta charset=\"utf-8\">\n  <title>Cassandra Index, неделя 25 октября 2026 года: 68 из 100, очень опасно, +4</title>\n</head>\n<body>\n  <h1>Cassandra Index — неделя 25 октября 2026 года</h1>\n  <ol>\n    <li>Мировой индекс — 68 из 100; изменение за неделю +4; состояние «очень опасно».</li>\n    <li>Драйвер 1: Вашингтон и Тегеран на пороге удара, Ормуз перекрыт. Вклад — высокий.</li>\n    <li>Драйвер 2: Йеменская война бьёт по аэропортам и нефти Саудовской Аравии. Вклад — высокий.</li>\n    <li>Драйвер 3: Олешки: гуманитарное перемирие согласовано, но фронт не стих. Вклад — высокий.</li>\n    <li>Слой предвестников (Д9) — 39 из 100; сигналящих подгрупп 7 из 8.</li>\n  </ol>\n  <p>Регионы: Ближний Восток — 78 (+9); Северная Америка — 72 (+6); Украина и Молдова — 68 (+5).</p>\n  <p>Покрытие критериев недели — 39 из 46.</p>\n  <p>\n    <a href=\"https://cassindex.ru\">Сайт</a> · \n    <a href=\"https://cassindex.ru/data/public/index.json\">Данные (JSON)</a> · \n    <a href=\"https://cassindex.ru/data/public/trend.svg\">Кривая</a> · \n    <a href=\"https://cassindex.ru/digest.html\">Архив выпусков</a>\n  </p>\n</body>\n</html>\n",
  "telegram": "<b>Cassandra Index — неделя 25 октября 2026 года</b>\n1. Мировой индекс — 68 из 100; изменение за неделю +4; состояние «очень опасно».\n2. Драйвер 1: Вашингтон и Тегеран на пороге удара, Ормуз перекрыт. Вклад — высокий.\n3. Драйвер 2: Йеменская война бьёт по аэропортам и нефти Саудовской Аравии. Вклад — высокий.\n4. Драйвер 3: Олешки: гуманитарное перемирие согласовано, но фронт не стих. Вклад — высокий.\n5. Слой предвестников (Д9) — 39 из 100; сигналящих подгрупп 7 из 8.\nРегионы: Ближний Восток — 78 (+9); Северная Америка — 72 (+6); Украина и Молдова — 68 (+5).\nПокрытие критериев недели — 39 из 46.\n<a href=\"https://cassindex.ru\">Сайт</a> · <a href=\"https://cassindex.ru/data/public/index.json\">Данные JSON</a> · <a href=\"https://cassindex.ru/data/public/trend.svg\">Кривая</a> · <a href=\"https://cassindex.ru/digest.html\">Архив</a>",
  "meta": {
    "items": 5,
    "regions": 3,
    "hasPrev": true
  }
}
