{
  "schema": "cassandra-index-digest",
  "schema_version": 1,
  "week": "2026-10-04",
  "subject": "Cassandra Index, неделя 4 октября 2026 года: 46 из 100, опасно, -1",
  "text": "Cassandra Index — неделя 4 октября 2026 года\n1. Мировой индекс — 46 из 100; изменение за неделю -1; состояние «опасно».\n2. Драйвер 1: Ядерная риторика и удары по энергетике усилились. Вклад — высокий.\n3. Драйвер 2: Санкции и энергетическое давление сжали рынки. Вклад — высокий.\n4. Драйвер 3: Вывод войск США из Ирака на фоне торговой войны союзников. Вклад — средний.\n5. Сильнее всего изменились регионы: Северная Америка (+14), Африка (-1), Европа (-1).\nРегионы: Северная Америка — 42 (+14); Африка — 44 (-1); Европа — 44 (-1).\nПокрытие критериев недели в снапшоте не опубликовано.\nСайт: https://cassindex.ru\nДанные: https://cassindex.ru/data/public/index.json\nКривая: https://cassindex.ru/data/public/trend.svg\nАрхив выпусков: https://cassindex.ru/digest.html\n",
  "html": "<!doctype html>\n<html lang=\"ru\">\n<head>\n  <meta charset=\"utf-8\">\n  <title>Cassandra Index, неделя 4 октября 2026 года: 46 из 100, опасно, -1</title>\n</head>\n<body>\n  <h1>Cassandra Index — неделя 4 октября 2026 года</h1>\n  <ol>\n    <li>Мировой индекс — 46 из 100; изменение за неделю -1; состояние «опасно».</li>\n    <li>Драйвер 1: Ядерная риторика и удары по энергетике усилились. Вклад — высокий.</li>\n    <li>Драйвер 2: Санкции и энергетическое давление сжали рынки. Вклад — высокий.</li>\n    <li>Драйвер 3: Вывод войск США из Ирака на фоне торговой войны союзников. Вклад — средний.</li>\n    <li>Сильнее всего изменились регионы: Северная Америка (+14), Африка (-1), Европа (-1).</li>\n  </ol>\n  <p>Регионы: Северная Америка — 42 (+14); Африка — 44 (-1); Европа — 44 (-1).</p>\n  <p>Покрытие критериев недели в снапшоте не опубликовано.</p>\n  <p>\n    <a href=\"https://cassindex.ru\">Сайт</a> · \n    <a href=\"https://cassindex.ru/data/public/index.json\">Данные (JSON)</a> · \n    <a href=\"https://cassindex.ru/data/public/trend.svg\">Кривая</a> · \n    <a href=\"https://cassindex.ru/digest.html\">Архив выпусков</a>\n  </p>\n</body>\n</html>\n",
  "telegram": "<b>Cassandra Index — неделя 4 октября 2026 года</b>\n1. Мировой индекс — 46 из 100; изменение за неделю -1; состояние «опасно».\n2. Драйвер 1: Ядерная риторика и удары по энергетике усилились. Вклад — высокий.\n3. Драйвер 2: Санкции и энергетическое давление сжали рынки. Вклад — высокий.\n4. Драйвер 3: Вывод войск США из Ирака на фоне торговой войны союзников. Вклад — средний.\n5. Сильнее всего изменились регионы: Северная Америка (+14), Африка (-1), Европа (-1).\nРегионы: Северная Америка — 42 (+14); Африка — 44 (-1); Европа — 44 (-1).\nПокрытие критериев недели в снапшоте не опубликовано.\n<a href=\"https://cassindex.ru\">Сайт</a> · <a href=\"https://cassindex.ru/data/public/index.json\">Данные JSON</a> · <a href=\"https://cassindex.ru/data/public/trend.svg\">Кривая</a> · <a href=\"https://cassindex.ru/digest.html\">Архив</a>",
  "meta": {
    "items": 5,
    "regions": 3,
    "hasPrev": true
  }
}
