{
  "schema": "cassandra-index-digest",
  "schema_version": 1,
  "week": "2026-09-13",
  "subject": "Cassandra Index, неделя 13 сентября 2026 года: 43 из 100, опасно, +1",
  "text": "Cassandra Index — неделя 13 сентября 2026 года\n1. Мировой индекс — 43 из 100; изменение за неделю +1; состояние «опасно».\n2. Драйвер 1: Массированный удар 8 сентября и атака дрона на границе с Молдовой. Вклад — высокий.\n3. Драйвер 2: Германия выдворяет дипломатов, ЕС готовит пакет до 1600 листингов. Вклад — высокий.\n4. Драйвер 3: Проверка боеготовности Беларуси и пуски КНДР. Вклад — средний.\n5. Сильнее всего изменились регионы: Европа (-7), Ближний Восток (+2), Африка (-1).\nРегионы: Европа — 37 (-7); Ближний Восток — 42 (+2); Африка — 43 (-1).\nПокрытие критериев недели — 41 из 46.\nСайт: https://cassindex.ru\nДанные: https://cassindex.ru/data/public/index.json\nКривая: https://cassindex.ru/data/public/trend.svg\nАрхив выпусков: https://cassindex.ru/digest.html\n",
  "html": "<!doctype html>\n<html lang=\"ru\">\n<head>\n  <meta charset=\"utf-8\">\n  <title>Cassandra Index, неделя 13 сентября 2026 года: 43 из 100, опасно, +1</title>\n</head>\n<body>\n  <h1>Cassandra Index — неделя 13 сентября 2026 года</h1>\n  <ol>\n    <li>Мировой индекс — 43 из 100; изменение за неделю +1; состояние «опасно».</li>\n    <li>Драйвер 1: Массированный удар 8 сентября и атака дрона на границе с Молдовой. Вклад — высокий.</li>\n    <li>Драйвер 2: Германия выдворяет дипломатов, ЕС готовит пакет до 1600 листингов. Вклад — высокий.</li>\n    <li>Драйвер 3: Проверка боеготовности Беларуси и пуски КНДР. Вклад — средний.</li>\n    <li>Сильнее всего изменились регионы: Европа (-7), Ближний Восток (+2), Африка (-1).</li>\n  </ol>\n  <p>Регионы: Европа — 37 (-7); Ближний Восток — 42 (+2); Африка — 43 (-1).</p>\n  <p>Покрытие критериев недели — 41 из 46.</p>\n  <p>\n    <a href=\"https://cassindex.ru\">Сайт</a> · \n    <a href=\"https://cassindex.ru/data/public/index.json\">Данные (JSON)</a> · \n    <a href=\"https://cassindex.ru/data/public/trend.svg\">Кривая</a> · \n    <a href=\"https://cassindex.ru/digest.html\">Архив выпусков</a>\n  </p>\n</body>\n</html>\n",
  "telegram": "<b>Cassandra Index — неделя 13 сентября 2026 года</b>\n1. Мировой индекс — 43 из 100; изменение за неделю +1; состояние «опасно».\n2. Драйвер 1: Массированный удар 8 сентября и атака дрона на границе с Молдовой. Вклад — высокий.\n3. Драйвер 2: Германия выдворяет дипломатов, ЕС готовит пакет до 1600 листингов. Вклад — высокий.\n4. Драйвер 3: Проверка боеготовности Беларуси и пуски КНДР. Вклад — средний.\n5. Сильнее всего изменились регионы: Европа (-7), Ближний Восток (+2), Африка (-1).\nРегионы: Европа — 37 (-7); Ближний Восток — 42 (+2); Африка — 43 (-1).\nПокрытие критериев недели — 41 из 46.\n<a href=\"https://cassindex.ru\">Сайт</a> · <a href=\"https://cassindex.ru/data/public/index.json\">Данные JSON</a> · <a href=\"https://cassindex.ru/data/public/trend.svg\">Кривая</a> · <a href=\"https://cassindex.ru/digest.html\">Архив</a>",
  "meta": {
    "items": 5,
    "regions": 3,
    "hasPrev": true
  }
}
