{
  "schema": "cassandra-index-digest",
  "schema_version": 1,
  "week": "2026-10-18",
  "subject": "Cassandra Index, неделя 18 октября 2026 года: 64 из 100, очень опасно, +8",
  "text": "Cassandra Index — неделя 18 октября 2026 года\n1. Мировой индекс — 64 из 100; изменение за неделю +8; состояние «очень опасно».\n2. Драйвер 1: Ормузский пролив заминирован, война расширяется на Красное море. Вклад — высокий.\n3. Драйвер 2: ЕС ввёл крупнейший пакет санкций, НАТО начала ядерные учения. Вклад — высокий.\n4. Драйвер 3: Санкционный маятник: США отсрочили ограничения, дроны ударили по тылу РФ. Вклад — высокий.\n5. Сильнее всего изменились регионы: Северная Америка (+11), Африка (+10), Балканы (+7).\nРегионы: Северная Америка — 63 (+11); Африка — 63 (+10); Балканы — 63 (+7).\nПокрытие критериев недели — 34 из 46.\nСайт: https://cassindex.ru\nДанные: https://cassindex.ru/data/public/index.json\nКривая: https://cassindex.ru/data/public/trend.svg\nАрхив выпусков: https://cassindex.ru/digest.html\n",
  "html": "<!doctype html>\n<html lang=\"ru\">\n<head>\n  <meta charset=\"utf-8\">\n  <title>Cassandra Index, неделя 18 октября 2026 года: 64 из 100, очень опасно, +8</title>\n</head>\n<body>\n  <h1>Cassandra Index — неделя 18 октября 2026 года</h1>\n  <ol>\n    <li>Мировой индекс — 64 из 100; изменение за неделю +8; состояние «очень опасно».</li>\n    <li>Драйвер 1: Ормузский пролив заминирован, война расширяется на Красное море. Вклад — высокий.</li>\n    <li>Драйвер 2: ЕС ввёл крупнейший пакет санкций, НАТО начала ядерные учения. Вклад — высокий.</li>\n    <li>Драйвер 3: Санкционный маятник: США отсрочили ограничения, дроны ударили по тылу РФ. Вклад — высокий.</li>\n    <li>Сильнее всего изменились регионы: Северная Америка (+11), Африка (+10), Балканы (+7).</li>\n  </ol>\n  <p>Регионы: Северная Америка — 63 (+11); Африка — 63 (+10); Балканы — 63 (+7).</p>\n  <p>Покрытие критериев недели — 34 из 46.</p>\n  <p>\n    <a href=\"https://cassindex.ru\">Сайт</a> · \n    <a href=\"https://cassindex.ru/data/public/index.json\">Данные (JSON)</a> · \n    <a href=\"https://cassindex.ru/data/public/trend.svg\">Кривая</a> · \n    <a href=\"https://cassindex.ru/digest.html\">Архив выпусков</a>\n  </p>\n</body>\n</html>\n",
  "telegram": "<b>Cassandra Index — неделя 18 октября 2026 года</b>\n1. Мировой индекс — 64 из 100; изменение за неделю +8; состояние «очень опасно».\n2. Драйвер 1: Ормузский пролив заминирован, война расширяется на Красное море. Вклад — высокий.\n3. Драйвер 2: ЕС ввёл крупнейший пакет санкций, НАТО начала ядерные учения. Вклад — высокий.\n4. Драйвер 3: Санкционный маятник: США отсрочили ограничения, дроны ударили по тылу РФ. Вклад — высокий.\n5. Сильнее всего изменились регионы: Северная Америка (+11), Африка (+10), Балканы (+7).\nРегионы: Северная Америка — 63 (+11); Африка — 63 (+10); Балканы — 63 (+7).\nПокрытие критериев недели — 34 из 46.\n<a href=\"https://cassindex.ru\">Сайт</a> · <a href=\"https://cassindex.ru/data/public/index.json\">Данные JSON</a> · <a href=\"https://cassindex.ru/data/public/trend.svg\">Кривая</a> · <a href=\"https://cassindex.ru/digest.html\">Архив</a>",
  "meta": {
    "items": 5,
    "regions": 3,
    "hasPrev": true
  }
}
