{
  "schema": "cassandra-index-digest",
  "schema_version": 1,
  "week": "2026-09-06",
  "subject": "Cassandra Index, неделя 6 сентября 2026 года: 42 из 100, опасно, -9",
  "text": "Cassandra Index — неделя 6 сентября 2026 года\n1. Мировой индекс — 42 из 100; изменение за неделю -9; состояние «опасно».\n2. Драйвер 1: Режим тишины 5–8 сентября и локальное перемирие на ЗАЭС. Вклад — высокий.\n3. Драйвер 2: Инцидент в Лейпциге вызвал дипломатический разрыв с Германией. Вклад — высокий.\n4. Драйвер 3: Учения НАТО в Прибалтике и рост оборонных бюджетов. Вклад — средний.\n5. Сильнее всего изменились регионы: Африка (-9), Южная Азия (-4), Европа (-4).\nРегионы: Африка — 44 (-9); Южная Азия — 45 (-4); Европа — 44 (-4).\nПокрытие критериев недели — 41 из 46.\nСайт: https://cassindex.ru\nДанные: https://cassindex.ru/data/public/index.json\nКривая: https://cassindex.ru/data/public/trend.svg\nАрхив выпусков: https://cassindex.ru/digest.html\n",
  "html": "<!doctype html>\n<html lang=\"ru\">\n<head>\n  <meta charset=\"utf-8\">\n  <title>Cassandra Index, неделя 6 сентября 2026 года: 42 из 100, опасно, -9</title>\n</head>\n<body>\n  <h1>Cassandra Index — неделя 6 сентября 2026 года</h1>\n  <ol>\n    <li>Мировой индекс — 42 из 100; изменение за неделю -9; состояние «опасно».</li>\n    <li>Драйвер 1: Режим тишины 5–8 сентября и локальное перемирие на ЗАЭС. Вклад — высокий.</li>\n    <li>Драйвер 2: Инцидент в Лейпциге вызвал дипломатический разрыв с Германией. Вклад — высокий.</li>\n    <li>Драйвер 3: Учения НАТО в Прибалтике и рост оборонных бюджетов. Вклад — средний.</li>\n    <li>Сильнее всего изменились регионы: Африка (-9), Южная Азия (-4), Европа (-4).</li>\n  </ol>\n  <p>Регионы: Африка — 44 (-9); Южная Азия — 45 (-4); Европа — 44 (-4).</p>\n  <p>Покрытие критериев недели — 41 из 46.</p>\n  <p>\n    <a href=\"https://cassindex.ru\">Сайт</a> · \n    <a href=\"https://cassindex.ru/data/public/index.json\">Данные (JSON)</a> · \n    <a href=\"https://cassindex.ru/data/public/trend.svg\">Кривая</a> · \n    <a href=\"https://cassindex.ru/digest.html\">Архив выпусков</a>\n  </p>\n</body>\n</html>\n",
  "telegram": "<b>Cassandra Index — неделя 6 сентября 2026 года</b>\n1. Мировой индекс — 42 из 100; изменение за неделю -9; состояние «опасно».\n2. Драйвер 1: Режим тишины 5–8 сентября и локальное перемирие на ЗАЭС. Вклад — высокий.\n3. Драйвер 2: Инцидент в Лейпциге вызвал дипломатический разрыв с Германией. Вклад — высокий.\n4. Драйвер 3: Учения НАТО в Прибалтике и рост оборонных бюджетов. Вклад — средний.\n5. Сильнее всего изменились регионы: Африка (-9), Южная Азия (-4), Европа (-4).\nРегионы: Африка — 44 (-9); Южная Азия — 45 (-4); Европа — 44 (-4).\nПокрытие критериев недели — 41 из 46.\n<a href=\"https://cassindex.ru\">Сайт</a> · <a href=\"https://cassindex.ru/data/public/index.json\">Данные JSON</a> · <a href=\"https://cassindex.ru/data/public/trend.svg\">Кривая</a> · <a href=\"https://cassindex.ru/digest.html\">Архив</a>",
  "meta": {
    "items": 5,
    "regions": 3,
    "hasPrev": true
  }
}
