{
  "schema": "cassandra-index-digest",
  "schema_version": 1,
  "week": "2026-08-30",
  "subject": "Cassandra Index, неделя 30 августа 2026 года: 51 из 100, опасно",
  "text": "Cassandra Index — неделя 30 августа 2026 года\n1. Мировой индекс — 51 из 100; состояние «опасно». Это первый выпуск: прошлой недели в публикации нет.\n2. Драйвер 1: Удары по глубокому тылу вышли на рекордный уровень. Вклад — высокий.\n3. Драйвер 2: Блокада чёрноморских портов остановила экспорт зерна. Вклад — высокий.\n4. Драйвер 3: Пуск мобильной «Ярс» подтверждён независимым мониторингом. Вклад — средний.\n5. Сильнее всего изменились регионы: Ближний Восток (-31), Европа (-20), Южная Азия (-9).\nРегионы: Ближний Восток — 49 (-31); Европа — 48 (-20); Южная Азия — 49 (-9).\nПокрытие критериев недели — 38 из 46.\nСайт: https://cassindex.ru\nДанные: https://cassindex.ru/data/public/index.json\nКривая: https://cassindex.ru/data/public/trend.svg\nАрхив выпусков: https://cassindex.ru/digest.html\n",
  "html": "<!doctype html>\n<html lang=\"ru\">\n<head>\n  <meta charset=\"utf-8\">\n  <title>Cassandra Index, неделя 30 августа 2026 года: 51 из 100, опасно</title>\n</head>\n<body>\n  <h1>Cassandra Index — неделя 30 августа 2026 года</h1>\n  <ol>\n    <li>Мировой индекс — 51 из 100; состояние «опасно». Это первый выпуск: прошлой недели в публикации нет.</li>\n    <li>Драйвер 1: Удары по глубокому тылу вышли на рекордный уровень. Вклад — высокий.</li>\n    <li>Драйвер 2: Блокада чёрноморских портов остановила экспорт зерна. Вклад — высокий.</li>\n    <li>Драйвер 3: Пуск мобильной «Ярс» подтверждён независимым мониторингом. Вклад — средний.</li>\n    <li>Сильнее всего изменились регионы: Ближний Восток (-31), Европа (-20), Южная Азия (-9).</li>\n  </ol>\n  <p>Регионы: Ближний Восток — 49 (-31); Европа — 48 (-20); Южная Азия — 49 (-9).</p>\n  <p>Покрытие критериев недели — 38 из 46.</p>\n  <p>\n    <a href=\"https://cassindex.ru\">Сайт</a> · \n    <a href=\"https://cassindex.ru/data/public/index.json\">Данные (JSON)</a> · \n    <a href=\"https://cassindex.ru/data/public/trend.svg\">Кривая</a> · \n    <a href=\"https://cassindex.ru/digest.html\">Архив выпусков</a>\n  </p>\n</body>\n</html>\n",
  "telegram": "<b>Cassandra Index — неделя 30 августа 2026 года</b>\n1. Мировой индекс — 51 из 100; состояние «опасно». Это первый выпуск: прошлой недели в публикации нет.\n2. Драйвер 1: Удары по глубокому тылу вышли на рекордный уровень. Вклад — высокий.\n3. Драйвер 2: Блокада чёрноморских портов остановила экспорт зерна. Вклад — высокий.\n4. Драйвер 3: Пуск мобильной «Ярс» подтверждён независимым мониторингом. Вклад — средний.\n5. Сильнее всего изменились регионы: Ближний Восток (-31), Европа (-20), Южная Азия (-9).\nРегионы: Ближний Восток — 49 (-31); Европа — 48 (-20); Южная Азия — 49 (-9).\nПокрытие критериев недели — 38 из 46.\n<a href=\"https://cassindex.ru\">Сайт</a> · <a href=\"https://cassindex.ru/data/public/index.json\">Данные JSON</a> · <a href=\"https://cassindex.ru/data/public/trend.svg\">Кривая</a> · <a href=\"https://cassindex.ru/digest.html\">Архив</a>",
  "meta": {
    "items": 5,
    "regions": 3,
    "hasPrev": false
  }
}
