{
  "schema": "cassandra-index-digest",
  "schema_version": 1,
  "week": "2026-10-11",
  "subject": "Cassandra Index, неделя 11 октября 2026 года: 56 из 100, опасно, +10",
  "text": "Cassandra Index — неделя 11 октября 2026 года\n1. Мировой индекс — 56 из 100; изменение за неделю +10; состояние «опасно».\n2. Драйвер 1: Хуситы расширили войну до Эр-Рияда, США блокируют Ормуз. Вклад — высокий.\n3. Драйвер 2: Ядерная сигнальная активность: пуск M51.3 и учения НАТО. Вклад — средний.\n4. Драйвер 3: Дизельная сделка США–РФ расколола Украину и Европу. Вклад — высокий.\n5. Сильнее всего изменились регионы: Ближний Восток (+28), Африка (+13), Восточная Азия (+13).\nРегионы: Ближний Восток — 67 (+28); Африка — 59 (+13); Восточная Азия — 59 (+13).\nПокрытие критериев недели — 27 из 46.\nСайт: https://cassindex.ru\nДанные: https://cassindex.ru/data/public/index.json\nКривая: https://cassindex.ru/data/public/trend.svg\nАрхив выпусков: https://cassindex.ru/digest.html\n",
  "html": "<!doctype html>\n<html lang=\"ru\">\n<head>\n  <meta charset=\"utf-8\">\n  <title>Cassandra Index, неделя 11 октября 2026 года: 56 из 100, опасно, +10</title>\n</head>\n<body>\n  <h1>Cassandra Index — неделя 11 октября 2026 года</h1>\n  <ol>\n    <li>Мировой индекс — 56 из 100; изменение за неделю +10; состояние «опасно».</li>\n    <li>Драйвер 1: Хуситы расширили войну до Эр-Рияда, США блокируют Ормуз. Вклад — высокий.</li>\n    <li>Драйвер 2: Ядерная сигнальная активность: пуск M51.3 и учения НАТО. Вклад — средний.</li>\n    <li>Драйвер 3: Дизельная сделка США–РФ расколола Украину и Европу. Вклад — высокий.</li>\n    <li>Сильнее всего изменились регионы: Ближний Восток (+28), Африка (+13), Восточная Азия (+13).</li>\n  </ol>\n  <p>Регионы: Ближний Восток — 67 (+28); Африка — 59 (+13); Восточная Азия — 59 (+13).</p>\n  <p>Покрытие критериев недели — 27 из 46.</p>\n  <p>\n    <a href=\"https://cassindex.ru\">Сайт</a> · \n    <a href=\"https://cassindex.ru/data/public/index.json\">Данные (JSON)</a> · \n    <a href=\"https://cassindex.ru/data/public/trend.svg\">Кривая</a> · \n    <a href=\"https://cassindex.ru/digest.html\">Архив выпусков</a>\n  </p>\n</body>\n</html>\n",
  "telegram": "<b>Cassandra Index — неделя 11 октября 2026 года</b>\n1. Мировой индекс — 56 из 100; изменение за неделю +10; состояние «опасно».\n2. Драйвер 1: Хуситы расширили войну до Эр-Рияда, США блокируют Ормуз. Вклад — высокий.\n3. Драйвер 2: Ядерная сигнальная активность: пуск M51.3 и учения НАТО. Вклад — средний.\n4. Драйвер 3: Дизельная сделка США–РФ расколола Украину и Европу. Вклад — высокий.\n5. Сильнее всего изменились регионы: Ближний Восток (+28), Африка (+13), Восточная Азия (+13).\nРегионы: Ближний Восток — 67 (+28); Африка — 59 (+13); Восточная Азия — 59 (+13).\nПокрытие критериев недели — 27 из 46.\n<a href=\"https://cassindex.ru\">Сайт</a> · <a href=\"https://cassindex.ru/data/public/index.json\">Данные JSON</a> · <a href=\"https://cassindex.ru/data/public/trend.svg\">Кривая</a> · <a href=\"https://cassindex.ru/digest.html\">Архив</a>",
  "meta": {
    "items": 5,
    "regions": 3,
    "hasPrev": true
  }
}
